{
  "id": "22222222-2222-2222-2222-222222222222",
  "tenantId": "55555555-5555-5555-5555-555555555555",
  "status": "CREATED",
  "version": 1,
  "summary": "LOCK_EXTENDED lock:lock-456",
  "sourceRefs": ["lock:lock-456"],
  "auditRecordId": "22222222-2222-2222-2222-222222222222",
  "subject": { "type": "lock", "id": "lock-456" },
  "action": "LOCK_EXTENDED",
  "actor": { "type": "USER", "id": "ops-user-1" },
  "result": "SUCCESS",
  "occurredAt": "2026-06-06T00:00:02Z",
  "integrityHash": "fixture-integrity-hash-computed-by-service-tests",
  "retentionUntil": "2033-06-06",
  "legalHold": true
}
