{
  "id": "11111111-1111-1111-1111-111111111111",
  "tenantId": "55555555-5555-5555-5555-555555555555",
  "status": "CREATED",
  "version": 1,
  "summary": "QUOTE_CREATED quote:quote-123",
  "sourceRefs": ["quote:quote-123"],
  "auditRecordId": "11111111-1111-1111-1111-111111111111",
  "subject": { "type": "quote", "id": "quote-123" },
  "action": "QUOTE_CREATED",
  "actor": { "type": "SERVICE", "id": "quote-service" },
  "result": "SUCCESS",
  "occurredAt": "2026-06-06T00:00:01Z",
  "integrityHash": "fixture-integrity-hash-computed-by-service-tests",
  "retentionUntil": "2033-06-06",
  "legalHold": false
}
